{"$id":"urn:randle:r5:compatibility-trust-root","$schema":"https://json-schema.org/draft/2020-12/schema","additionalProperties":false,"properties":{"accepted_specification_interface":{"const":"RANDLE-R5-BOUNDARY-1"},"future_package_interface":{"const":"RANDLE-R5-FUTURE-PACKAGE-1"},"issuance_policy":{"const":"INDEPENDENT_EVIDENCE_REQUIRED"},"issuer_capabilities":{"items":false,"maxItems":1,"minItems":1,"prefixItems":[{"const":"ISSUE_COMPATIBILITY"}],"type":"array"},"issuer_identity":{"const":"independent-compatibility-issuer"},"issuer_role":{"const":"SPECIFICATION_COMPATIBILITY_AUTHORITY"},"required_authority_set_identity":{"const":"9999999999999999999999999999999999999999999999999999999999999999"},"required_schema_set_identity":{"const":"8888888888888888888888888888888888888888888888888888888888888888"},"schema_version":{"const":"7.0.0-DRAFT"},"trust_root_id":{"const":"R5-COMPATIBILITY-TRUST-ROOT"},"valid_from":{"const":"2026-07-22T00:00:00Z"},"valid_until":{"const":"2026-07-23T00:00:00Z"},"verifier_code_identity":{"const":"d55fafeefae67d10957a5386f5fa2aa9740d6f94"},"verifier_interface_version":{"const":"RANDLE-R5-COMPATIBILITY-1"}},"required":["schema_version","trust_root_id","issuer_identity","issuer_role","issuer_capabilities","valid_from","valid_until","accepted_specification_interface","future_package_interface","required_schema_set_identity","required_authority_set_identity","verifier_code_identity","verifier_interface_version","issuance_policy"],"type":"object"}
