{"accepted_specification_interface":"RANDLE-R5-BOUNDARY-1","future_package_interface":"RANDLE-R5-FUTURE-PACKAGE-1","issuance_policy":"INDEPENDENT_EVIDENCE_REQUIRED","issuer_capabilities":["ISSUE_COMPATIBILITY"],"issuer_identity":"independent-compatibility-issuer","issuer_role":"SPECIFICATION_COMPATIBILITY_AUTHORITY","required_authority_set_identity":"9999999999999999999999999999999999999999999999999999999999999999","required_schema_set_identity":"8888888888888888888888888888888888888888888888888888888888888888","schema_version":"7.0.0-DRAFT","trust_root_id":"R5-COMPATIBILITY-TRUST-ROOT","valid_from":"2026-07-22T00:00:00Z","valid_until":"2026-07-23T00:00:00Z","verifier_code_identity":"d55fafeefae67d10957a5386f5fa2aa9740d6f94","verifier_interface_version":"RANDLE-R5-COMPATIBILITY-1"}
